{
  "id": "int_20261003_ywz3fhc5",
  "runId": "run_20261003_07apd3cj",
  "runKind": "replay",
  "capabilityId": "lookup-member-savings-balance",
  "stepId": "s08",
  "reason": {
    "code": "unrecoverable_condition",
    "message": "session expired (page shows \"Your session has expired\") while step s08 postcondition not met"
  },
  "screenshotPath": "shots/129.png",
  "currentUrl": "http://localhost:4173/workstation",
  "createdAt": "2026-10-03T13:55:27.184Z",
  "status": "resolved",
  "resolution": {
    "by": "scripted-operator",
    "at": "2026-10-03T13:55:28.722Z",
    "notes": "scripted operator re-authenticated in the same browser session by re-running the derived sign-in steps (s01, s02, s03, s04, s05); current_step (resuming at s06, the first step after the sign-in: the expiry hit s08; what the steps after the sign-in built went with the session)",
    "humanActions": [
      {
        "ts": "2026-10-03T13:55:27.243Z",
        "type": "navigate",
        "frame": [],
        "target": {},
        "url": "http://localhost:4173/login"
      },
      {
        "ts": "2026-10-03T13:55:27.301Z",
        "type": "input",
        "frame": [],
        "target": {
          "tag": "input",
          "role": "textbox",
          "name": "User ID",
          "selector": "input[type=\"text\"][name=\"userId\"]"
        },
        "valueRedacted": true,
        "url": "http://localhost:4173/login"
      },
      {
        "ts": "2026-10-03T13:55:27.493Z",
        "type": "input",
        "frame": [],
        "target": {
          "tag": "input",
          "role": "textbox",
          "name": "Password",
          "selector": "input[type=\"password\"][name=\"password\"]"
        },
        "valueRedacted": true,
        "url": "http://localhost:4173/login"
      },
      {
        "ts": "2026-10-03T13:55:27.928Z",
        "type": "click",
        "frame": [],
        "target": {
          "tag": "input",
          "role": "button",
          "name": "login",
          "selector": "input[type=\"image\"][name=\"login\"]"
        },
        "valueRedacted": true,
        "url": "http://localhost:4173/login"
      },
      {
        "ts": "2026-10-03T13:55:27.931Z",
        "type": "submit",
        "frame": [],
        "target": {
          "tag": "form",
          "role": "generic",
          "name": "Operator Sign-On User ID: Password:",
          "text": "Operator Sign-On User ID: Password:",
          "selector": "form"
        },
        "valueRedacted": true,
        "url": "http://localhost:4173/login"
      },
      {
        "ts": "2026-10-03T13:55:28.027Z",
        "type": "navigate",
        "frame": [],
        "target": {},
        "url": "http://localhost:4173/workstation"
      },
      {
        "ts": "2026-10-03T13:55:28.038Z",
        "type": "navigate",
        "frame": [
          {
            "name": "banner"
          }
        ],
        "target": {},
        "url": "http://localhost:4173/frames/banner"
      },
      {
        "ts": "2026-10-03T13:55:28.040Z",
        "type": "navigate",
        "frame": [
          {
            "name": "nav"
          }
        ],
        "target": {},
        "url": "http://localhost:4173/frames/nav"
      },
      {
        "ts": "2026-10-03T13:55:28.042Z",
        "type": "navigate",
        "frame": [
          {
            "name": "main"
          }
        ],
        "target": {},
        "url": "http://localhost:4173/members/search"
      }
    ],
    "resumeFrom": "current_step",
    "resumeAtStepId": "s06"
  }
}